Comment,Liked
"Extremely limited limitations for a very limited Bluetooth user, especially in sending and receiving files and images and video",0
Beautiful dual-brand brand name,1
"More importantly, the operating system, which is slightly weaker, is more like a prison because it does not have access to anything. Hope to be better",0
"It has a great graphic processor, it's excellent and there's no weakness",1
"I have this phone, I'm so pleased with it, and I do not speak good games like Pabni and Fortinite, I'm great I love him.",1
"In terms of beauty, elegance and quality, no brand is as much as that. Do not hesitate to make a genuine brand and a luxury item in your purchase",1
"This great phone, I suggest you buy your home country",1
All-glass structure of super size with good display efficiency,1
The quality of construction and high facilities and beautiful appearance,1
The high price of highlighting the camera weighs a little too much,0
I got this phone and I'm very pleased.,1
The handset is very robust in all respects and is quite affordable in terms of memory capacity.,1
Very suitable for use as phablet and unmatched for gaming,1
"By the year before, it would be all about buying it with all its high prices. But this price is not really reasonable for buying, and little can buy it.",0
"Since the home button was removed from it, authenticity and specificity also disappeared",0
"Well, but not worth it with this price",0
Just looking for more profits and reducing the quality of the product,0
"I've come up with software updates, I can say that even once did not hang around",1
"It makes you feel good, quality and facilities is not enough and disappointing",0
The larger size and the richer and more robust hardware are advanced,1
The quality of the camera and the speed of the phone is just unique and unique,1
good It is really great at all,1
Superior screen quality crazy screen,1
The camera's emergence and weak battery are its weaknesses,0
Its features are so low that it does not cost much at all,0
"If you can buy it, do not hesitate to buy it",1
Regular and excellent updates and system security,1
Flexible user interface and user friendly. Good quality camera,1
Very simple and user-friendly interface,1
The system is not smooth and the code is faulty and incomplete,0
Materials are of no quality and not durable,0
The company did not succeed in making this product proud and not successful,0
The low-end processor is not so good just the class,0
"Very low charge, eliminating hands-free conversion, is also very high",0
AI is strong and it's a great phone,1
I saw very well that it was not nice. The processor is weak,0
The charging speed is very low and does not reverse charge,0
Varied and beautiful colors and high build quality due to the use of high quality metal and glass and covering the front and back surfaces,1
"Extremely large display with a very good and excellent quality, which is very absorbed by the body, and the low resolution of the cut-out display and super-processor",1
High price does not support camera lens memory card,0
"So strong and stylish and lifelong, you have to get your hands to understand what I mean",1
It does not matter if you do not have the money to buy it,1
Powerful system and great facilities do not have much to cook,0
The size is too large and not suitable for everyday use,0
"At lower prices, these products can be better off and not worth buying",0
It is not high quality and powerful,1
There is nothing to say about it in comparison to duplicate rivals without creativity,0
Design is beautiful and well-designed,1
"Most of the money is branded, or else the rest of the competition is better",0
Excellent high-speed display. Stylish and beautiful battery,1
"Similar to the previous generation, not having a fast charging price",0
Extremely large body design and high-speed unique phone,1
It is always innovative in various fields and special brand and luxury,1
Superior technology has made it unrivaled,1
Higher prices make it worse,0
Precision camera with gigantic and quality display,1
The protruding camera out of the body of the lack of specific innovation over the previous generation,0
It's not worth the purchase because the screen and the camera are poor,0
It is very horny and attractive and beautiful,1
Its exterior design has a lot of charm that is considered a positive point,1
I was surprised by the high power and good functioning of the device,1
"The high price makes it impossible for Iran to buy it, I wish it was not grown",0
"It does not have the ability to compete with new and up-to-date models and overall has a moderate, and perhaps even weak, quality.",0
It would have been better if the camera had a dual standby or more chargeable capacity,0
"Unfortunately, after a week of using the product, I'm not happy about its quality",0
Weak and poor support when you buy if you do not care about the warranty and the provider,0
I regret buying this product and decide to post it.,0
"The way the device works is not good and the customer is not satisfied, its makers must be responsive",0
"How long you use it, you fall in love and you can not leave it alone",1
The accuracy of the sensors could be better now is a little weak and not satisfactory,0
Good and efficient. Summarizing everything is great,1
"A wholesome and interesting product. If you get higher prices, do not hesitate to buy",1
"The price for us in Iran is excessive, but I think it's worth the purchase because it's a full-fledged phone",1
"Its a good camera, but it does not matter to me about the battery, and it's good to keep charging",1
"Everything is great and, as always, its products are good and efficient",1
You can use two SIM cards simultaneously. This is good news for us,1
"No matter how good it is, not too much money. Unfortunately, only rich people can buy it",0
great image recognition Faster Unique Page Quality,1
Hardware Compatibility with the Operating System ease of use of the handset,1
Beautifully designed long-term psychological design,1
It's old and it's not used in the past,0
Its quality is downgraded and not supported,0
Consumers of this product will experience a severe decline in performance after a few years,0
No grunge is not without reason. The superiority of this can not be ignored cause it's good,1
Shelf life is a very important product that has a brilliant background in this field,1
"The competitors are better, so take less money and buy them that your money is not worse",0
There is only lacquer but it's not great. It's not worth it,0
It's just out of sight and it's not used here. Everyone is full of restrictions,0
No bias Be logical it is not a good choice,0
"The display quality is high, but it's a lot big, and it's not enough for this screen",0
Good build quality and gold-resisting body,1
The high speed and fluidity of the system are up-to-date and luxury,1
